,url,title,category,up_datetime,content
586,https://www.chinatimes.com/realtimenews/20220227001112-260405,藉俄烏戰爭看清朋友 律師曝10種人要遠離：出賣你的就是他,生活,2022-02-27 10:57,俄羅斯及烏克蘭戰爭引發全球關注，知名律師呂秋遠表示，藉由這次國際大事，他歸納台灣人有10種反應，包括訕笑應趁機收留烏克蘭女性、提倡小國不要挑釁大國、台海開戰沒人會幫助台灣、買武器沒意義、一旦戰爭台灣撐不過3天、兩岸開打台獨分子一定落跑等，提醒網友要遠離「汙染源」，因為這10類人，很可能就是第一個出賣你的人。呂秋遠昨（26）日於指出，對於俄羅斯侵略烏克蘭一事，我們能做的事不多，只能盡量聲援、支持制裁，也可藉這次事件，看到台灣人的反應，若身邊的朋友出現10種狀況，「不用懷疑，他就是你該遠離的對象」。呂秋遠表示，第1種是訕笑台灣應趁機收留烏克蘭女性的人，這種人腦袋裡只有正妹，沒有正義，思維裡也都是齷齪的人口販運想法，現實生活中大概也是物化女性的人。第2是那些大喊不要戰爭的人，戰爭當然是悲劇，但這一類人分不清楚是非對錯就譴責戰爭，卻不是譴責發動戰爭的人，現實生活若是遇到壞人，也只會忍氣吞聲。第3為讚嘆普丁神勇果決、美國爸爸不可信的人，呂秋遠認為，這一種人因為相信暴力、執迷權力，但邏輯常常互相矛盾。第4是提倡大國強大，小國不要挑釁，否則會落得跟烏克蘭一樣的下場，呂秋遠說，這種人完全沒看懂孟子所說的「大事小以仁，小事大以智」的想法，而是主張，「大事小以霸，小事大以舔」，往後遇到比他凶悍的人，大概也就是跪而已。第5是那些高喊開戰後，沒有任何國家會來幫助台灣的人，呂秋遠指出，因為這類人對自己沒有信心，呈現的是一種自暴自棄的狀況。第6為強調買武器沒意義的人，認為武器應該要他國贈送，並非自己購買，這一類人平常就覺得自己很重要，眼中只有自己，所以薪水不是用賺的，應該要是老闆送的。第7是台灣應該要跟大陸簽訂和平協議，不然就會滅亡的人，呂秋遠說，俄羅斯與烏克蘭也有簽訂明斯克和平協議，但還是發生戰爭。第8是嘲笑台海開打後，台灣撐不過3天的人，「台灣人都只是鍵盤上的勇士 」，卻不知道台灣的軍事力量排行在全球第22名，且台灣海峽的制海權與制空權是很難跨越的障礙，再加上台灣臥虎藏龍，刁民甚多，根本難纏。第9是認為戰爭來了，台獨分子一定會逃跑的人，呂秋遠說，因為飛彈和子彈並不會挑顏色打，一旦被占領，有錢人才有機會逃跑。最後是呼籲大陸給台灣兩巴掌，台灣才會聽話的人，呂秋遠認為這種人在現實生活中，不認生母、養父，為了一口飯，只認主人。最後呂秋遠感嘆，在台灣有不少人會說這10種話，提醒網友要遠離「汙染源」，因為哪天台灣真的發生戰爭，出賣你的人，就是他。
587,https://www.chinatimes.com/realtimenews/20220227001817-260408,俄軍：與烏民警衛隊共保車諾比核電廠安全,國際,2022-02-27 14:55,據《環球時報》引述俄羅斯國防部消息，俄羅斯空降兵部隊已與烏克蘭國民警衛隊一個獨立營達成協議，雙方共同保障車諾比核電廠的動力裝置、石棺和乏核燃料儲存設施的安全，確保民族主義者或其他恐怖組織無法利用烏克蘭的局勢進行核恐嚇。目前核電站工作人員監測核電站放射的工作仍在正常進行。而稍早當地時間25日國際原子能機構通報表示，烏克蘭的車諾比核電站所在地區輻射水準低，不會造成威脅。國際原子能機構表示，車諾比核電站輻射測量值在當天早些時候出現了升高。烏克蘭監管機構表示，輻射值升高可能是由於重型軍用車輛攪動了被1986年事故污染的土壤。國際原子能機構評估認為，監管機構報告的輻射值讀數——每小時9.46微西弗，是一個較低的值，仍然在相關範圍之內，因此不會對公眾構成任何危險。根據法新社稍早24日引述烏克蘭官方宣稱，他們與俄羅斯軍隊在車諾比核電站附近發生激戰。一度傳出一核廢料儲存設施疑似遭到摧毀。
588,https://www.chinatimes.com/newspapers/20220227000457-260112,安妮莫名挨轟願世界和平,娛樂新聞,2022-02-27 04:10,日前俄烏開戰，引來許多烏克蘭藝人為家鄉發聲，反觀俄羅斯籍的藝人則處境尷尬。在台發展9年的俄羅斯籍辣模安妮近日遭網友撻伐，但多數理性網友為她緩頰，「罵她的人很有事，到底打仗關她何事」，無端挨轟的安妮昨也回應。安妮去年上《同學來了》大聊俄羅斯和烏克蘭女生的差別，表示：「俄羅斯的女生還是比較時尚感，因為俄羅斯比較有錢，然後烏克蘭也是很棒的國家，我超愛烏克蘭」，稱烏克蘭比較像「俄羅斯的鄉下」，這段帶有節目效果的片段，近來因俄烏開戰被網友挖出瘋傳，安妮的社群網站因此慘被攻陷。父親是烏克蘭人、母親是俄羅斯人的安妮，原本不願多談俄烏一事，為平息部分網友怒火，昨表示：「烏克蘭和俄羅斯都是我的家人，兩邊都有家人和朋友，我們都很難過，沒有人支持戰爭，大家只希望能平平安安過日子，世界需要愛，願世界和平。」她也謝謝朋友們和粉絲的鼓勵，表示留言和訊息都看到了。曾和她合拍電影《詭祭》的曹晏豪和鍾瑶昨發文力挺，曹指出酸民完全罵錯：「Annie是我妹妹，是源於異地但同心的家人。她是俄羅斯人也是一半烏克蘭。」並透露安妮個性善良且努力；鍾瑶則希望大家停止對在台的俄羅斯人仇恨及謾罵，「請問這個行為跟疫情期間莫名仇視，並毆打亞洲人有什麼差別？」
589,https://www.chinatimes.com/newspapers/20220227000294-260119,俄警告芬蘭瑞典 不准加入北約,國際大事,2022-02-27 04:10,俄羅斯攻打烏克蘭，令周邊國家也都很緊張，尤其是那些沒有加入北約組織（NATO）的國家。俄國25日就對芬蘭、瑞典發出嚴正警告，威脅他們不許加入北約，否則將會面臨「嚴重的軍事與政治後果」。與此同時，為防範俄烏戰事擴大，北約則宣布首次啟動快速反應部隊（NRF），以加強其東翼成員的防禦。芬蘭動搖 瑞典仍抱持不結盟俄國外交發言人沙卡洛娃稱，「芬蘭和瑞典不應將自身安全建立在損害他國安全的基礎之上」，還說，「我們將芬蘭政府的軍事不結盟政策，視為確保北歐安全與穩定的重要基礎。」北歐5國之中，丹麥、挪威、冰島皆是北約創始國，2014年俄國吞併克里米亞以後，芬蘭、瑞典也開始考慮是否尋求加入北約。24日，芬蘭總理馬林與瑞典總理安德森雙雙譴責俄國入侵烏克蘭。馬林還稱，「芬蘭目前並未面對直接的軍事威脅，但現在對於加入北約的爭論將會改變。若國家安全成為問題，芬蘭就會準備好加入。」但她也強調，這須獲得國會和民意的支持。安德森則表示，瑞典仍抱持不加入北約的立場。她說：「瑞典長期以來一直沒有結盟，如此很好地維護瑞典的利益。」波羅的海三國 呼籲更多增援俄國總統普丁曾痛批北約不斷東擴，尤其是烏克蘭爭取加入北約，他並稱出兵烏克蘭旨在令其「去軍事化」及保持中立。烏克蘭是否會「芬蘭化」受到關注。但「芬蘭化」概念本身就帶有貶義，因為當年芬蘭也是二戰戰敗國，只能忍辱犧牲部分獨立性，在國際事務上順從蘇聯，直到蘇聯解體、芬蘭加入歐盟後，這樣情形才不復存在。愛沙尼亞、拉脫維亞和立陶宛等波羅的海三國，當年更遭受過蘇聯鐵蹄蹂躪，亦擔心成為俄國下一個目標，因此呼籲北約向其派遣更多增援部隊。增兵逾30地點 加強東翼防禦北約30個成員國的領導人25日召開視訊峰會，會後聲明嚴正譴責俄國發動戰爭，而北約除表示會繼續向烏克蘭提供武器，包括防空系統外，還首次啟動其快速反應部隊（NRF）。NRF是一支由海陸空和特種部隊組成的多國部隊，兵力達4萬人，調動NRF須北約全體成員國同意。北約祕書長史托騰柏格峰會結束後表示，美國、加拿大和歐盟已向北約東翼地區超過30個地點部署數千名士兵，100多架戰機及120艘艦艇，高度戒備中 。
590,https://www.chinatimes.com/newspapers/20220227000107-260203,王毅：中方樂見俄烏盡快對話談判,全球財經,2022-02-27 04:10,中國國務委員兼外長王毅25日分別應約與英國、歐盟、法國外交官通電話時表示，中方歡迎俄羅斯和烏克蘭，盡快舉行直接對話談判。中國外交部網站顯示，王毅25日分別應約與英國外交大臣特拉斯（Liz Truss）、歐盟外交與安全政策高級代表博雷利（Josep Borrell）和法國總統外事顧問博納（Emmanuel Bonne）通電話，重點針對烏克蘭局勢深入交換意見。王毅在通話中，闡述中方對烏克蘭問題的五大基本立場：一、中方堅定主張尊重和保障各國的主權和領土完整，確實遵守聯合國憲章宗旨和原則。此一立場是一貫的，也是明確的，在烏克蘭問題上同樣適用。二、中方倡導共同、綜合、合作、可持續的安全觀。三、中方一直關注烏克蘭問題的演變，目前的局勢是中方不願看到的。四、中方支持和鼓勵一切有利於和平解決烏克蘭危機的外交努力。五、中方認為聯合國安理會應當為解決烏克蘭問題發揮建設性作用，要以地區和平穩定為重，以各國普遍安全為重。另一方面，中國國家主席習近平25日和俄羅斯總統普丁通電話。普丁表示，美國和北約長期無視俄羅斯合理安全關切，一再背棄承諾，不斷向東推進軍事部署，挑戰俄羅斯戰略底線。另外，俄方願意和烏方展開高級別談判。習近平指出，中方根據烏克蘭問題本身的是非曲直決定中方立場，要摒棄冷戰思維，重視和尊重各國合理安全關切，透過談判形成均衡、有效、可持續的歐洲安全機制。
591,https://www.chinatimes.com/newspapers/20220227000126-260209,澤倫斯基 喜劇演員人生如戲,專題周報,2022-02-27 04:10,俄羅斯大軍兵臨首府基輔城下，44歲的烏克蘭總統澤倫斯基（Volodymyr Zelensky）24日穿著西裝，站在烏克蘭地圖前發表演說，誠摯地呼籲和平。他慨歎無人與他們並肩作戰，烏克蘭人的未來掌握在自己手中。他又斥責俄羅斯打算推翻烏克蘭民主政府，而他被列為頭號目標，他的家人則是二號目標，但他與家人都將堅守基輔城。這種肅穆的語調令人擔憂這名喜劇演員出身的年輕總統，是否將步向悲劇的命運。「團結日」難化干戈為玉帛澤倫斯基2月19日親赴德國出席慕尼黑安全會議。接受外媒採訪時翻譯耳機故障，他展現喜劇演員本色，開玩笑說受到俄羅斯網攻。早前對於華府警告俄國2月16日將攻打烏克蘭，澤倫斯基先是嗤之以鼻，斥責拜登政府誇大俄烏開戰的可能性。他並將當天訂為「團結日」（Day of Unity）來反諷，「這一天我們要懸掛國旗，繫上藍色和黃色（烏克蘭國旗色）的絲帶，向全世界展現我們的團結。」澤倫斯基在主政前，是烏克蘭家喻戶曉的喜劇演員，他在一齣大受歡迎的政治喜劇《人民公僕》中飾演高中老師，學生將他滿嘴髒話痛罵貪腐政府的片段拍成影片，上傳到網路上後意外爆紅，然後誤打誤撞成了一國總統。假戲真做成一國領袖澤倫斯基的經歷映照出戲如人生，他假戲真做於2019年參選總統，在第二輪決選以破七成的得票率，擊潰尋求連任的波洛申科（Petro Poroshenko）當選。但不滿他的人，將其與國際爭議性的政治名人相提並論，好比義大利前總理貝魯斯柯尼、美國前總統川普。澤倫斯基是猶太人，他說自己祖父的三名兄弟在二戰時遭德軍殺害，他的祖父則倖存下來。從政經驗宛如白紙的澤倫斯基，與世界領袖同台表現生硬而被詬病。烏克蘭政治分析師達維尤克（Mykola Davydyuk）指出:「我想我們的國際盟友跟他處不來，他跟他們不是同一等級。他們的高度他無法企及，也無法理解。」毀譽參半 不老練但有魅力但有西方外交官似乎臣服於他的魅力，不具名外交人士表示：「坦白說，他做得不差。他背負不可能任務，在俄羅斯與美國的雙重壓力下陷入困境，他表現地很鎮定。」分析師指出，澤倫斯基被迫走政治鋼索，一邊是烏東和烏南的親俄勢力，一邊是中部和烏西的親歐美派，希望基輔當局加入歐盟及北約，他必須在兩邊取得平衡。基輔分析師庫什（Aleksey Kushch）受訪表示:「從澤倫斯基採取的立場看來他不夠老練，外交政策上屈服及捍衛國內政權正當性是有落差。」
592,https://www.chinatimes.com/realtimenews/20220227001321-260407,川普稱「我當總統普丁就不敢亂來」林濁水一句話反嗆回去,政治,2022-02-27 11:50,前美國總統川普日前在極右派廣播「Clay Travis and Buck Sexton Show」上提到烏克蘭危機時，痛批美國總統拜登的無能領導，才使俄羅斯總統普丁氣焰更盛，更稱「如果我當總統，普丁就不敢亂來」，對此，前綠委林濁水直言，川普「真是大言不慚」。林濁水今（27日）在臉書發文表示，川普說如果他當總統普丁就不敢亂來，烏克蘭戰爭就不會發生，「真是大言不慚」，林痛批，川普搞美國第一，毫無總體戰略觀點，搞得北約諸國更加分崩離析，德國前總理梅克爾被川普嚇到，油然而生拉俄制衡美國之心，讓普丁認為有機可乘。其次，林濁水指出，川普糊裡糊塗，搞貿易戰，幸好被川普傑出幕僚順勢帶到科技戰，產業鍊重構的系統戰，雖不符川普本意，從歷史角度看，貢獻還是大得不得了，不過不管是搞不清楚狀況，或是耍賴就誇大口，不免幾分滑稽。一些網友在其po文底下留言表示，「大師說實話會被川普支持者出征喔」、「九成不同意大師論點」、「不是大言不慚是真的，川普從不按牌理出牌，梅克爾都會被嚇到，普丁不會？川普很敢，狠中之狠」。
593,https://www.chinatimes.com/newspapers/20220227000430-260109,台灣別逼北京攤牌,時論廣場,2022-02-27 04:10,俄羅斯大舉出兵烏克蘭，舉世震驚。然而，更讓人瞠目結舌的是，面對「戰鬥民族」的鐵蹄，與烏克蘭打得火熱的美國及其西方盟友只是作出了外交譴責與經濟制裁的制式反應，沒有派出一兵一卒同烏並肩作戰。陷入絕境的烏克蘭只能孤軍奮戰，總統澤倫斯基甚至哀歎自己的國家已經被西方完全拋棄。烏克蘭身處俄羅斯與美歐之間，本應左右逢源，卻狐假虎威，甘當西方反俄馬前卒。從這個角度看，烏克蘭今天的遭遇很難說不是咎由自取。繼去年的阿富汗變局後，俄烏戰爭再次將台灣推上國際熱搜。為了安撫人心，蔡英文和蘇貞昌均出面強調「台灣與烏克蘭不同」。台灣與烏克蘭當然不能相提並論，但民進黨政府正在犯與烏克蘭相同的戰略錯誤。按照普丁的講法，俄羅斯與烏克蘭本就是一家人，即使分家後莫斯科還是對基輔照顧有加，但後者卻將烏克蘭的主體性建立在否認與俄羅斯存在任何聯繫的基礎之上，並試圖破壞生活在烏克蘭幾代人的意識和歷史記憶。普丁指責烏克蘭當局一邊推動「去俄羅斯化」，一邊將西方勢力引入烏克蘭，以對抗所謂的「俄羅斯威脅」。與此同時，美國和北約背信棄義，不斷壓縮俄羅斯的生存空間。國家安全遭受嚴重威脅的俄羅斯忍無可忍，才被迫出手修理烏克蘭這個忘恩負義的西方馬仔。普丁的敘述自然是為了論證出兵烏克蘭的正當性，但也揭示了基輔的利令智昏。同樣地，台灣和大陸同屬中華民族，共用中華文化，雖然在政治上延續對立，但至今在法理上沒有分家。然而，民進黨政府為了牟取一己私利，處心積慮推行「去中國化」，不擇手段煽動兩岸對抗，千方百計割裂台灣與中華文化的聯繫。最近，麥田出版社出版作家曹雨的《激辣中國》，竟將書中所有的「大陸」二字都替換成「中國」，弄巧成拙爆出了「哥倫布發現新中國」的笑話。國台辦評價這是一齣走火入魔的鬧劇，「是民進黨當局推動去中國化造成的又一惡果」。民進黨如果在「去中國化」問題上不知收斂，兩岸人民在感情上只會越走越遠，大陸民間的反台情緒也得不到根本紓解。和烏克蘭當局一樣，民進黨政府也採取對美國一邊倒的政策，甘當華盛頓遏制北京的馬前卒。尤其是近年來美台加強了軍事聯繫，除了常規性的對台軍售，美國還多次派出軍用飛機起降台灣，不憚於刺激北京的神經。自我陶醉於「台美關係史上最佳」的民進黨不僅對美國的武器裝備照單全收，還別有用心地證實美國在台灣有軍隊存在，簡直唯恐天下不亂。在民進黨大內宣的反覆洗腦下，竟有不少台灣民眾老神在在，相信台灣有事時美國定會出兵，因此對於大陸的武統警告充耳不聞。事實果真如此嗎？烏克蘭同樣仗著美國撐腰有恃無恐，戰端一開卻求告無門。因為拜登不敢跟普丁硬碰硬，便以烏克蘭不是北約盟國為由，宣布美國沒有出兵的義務，然後坐視烏克蘭淪陷。台灣不但不是美國的正式盟友，美國也從來沒有承諾會出兵援台。如果民進黨不吸取烏克蘭的教訓，一旦兩岸攤牌，華盛頓敢跟北京硬碰硬？台灣大概就是下一個棄子。
594,https://www.chinatimes.com/realtimenews/20220227002006-260407,洪秀柱稱「入侵者不是我們說了算」蔣萬安：俄入侵烏領土絕對嚴厲譴責,政治,2022-02-27 15:30,俄羅斯入侵烏克蘭，國民黨大老紛紛提出意見評論。國民黨前主席洪秀柱認為，「入侵者」和「受害者」的角色該如何定義，絕對不是由我們說了算。對此，國民黨立委蔣萬安27日受訪時強調，對於俄羅斯對烏克蘭的軍事行動，當然予以譴責，對於任何侵入領土行為，絕對嚴厲譴責。對於洪秀柱稱烏克蘭、俄羅斯誰是入侵者、受害者不應該由我們定義，蔣萬安回應，「對於俄羅斯對烏克蘭的軍事行動，我們當然予以譴責」，對於任何侵入領土行為，絕對嚴厲譴責，他也呼籲蔡政府仔細思考提供人道救援可能性，對於未來可能發生問題，包括對全球供應鏈衝擊、民生物資影響等，都應提早因應。被問及洪秀柱的言論與台灣主要認知不太一樣？蔣萬安再次重申，「所以在烏俄戰爭，俄羅斯對於烏克蘭的的侵入行為當然是予以譴責」，這是目前國人透過外媒報導所感受到，對於和平、反戰價值的堅持，是國人共同共識。國民黨副主席連勝文於臉書國民黨沒有屈服武力脅迫、字典沒有投降，綠營卻「發射」口水、鍵盤保護台灣，蔣萬安說，昨天看到外電報導中，烏克蘭有一對情侶提前完婚，完婚之後馬上拿起武器站上第一線捍衛國家，這真的令人非常感動，烏俄戰爭告訴我們的是，國家面對關鍵時刻，就要不分黨派，大家團結一致對外。媒體追問，可以認同國民黨字典沒有投降的說法？蔣萬安說，全國都應該有一樣的信念，國家面臨危急、關鍵時刻，全國上下都不應分黨派團結一致對外。對於內容被認為是在分化台灣，蔣萬安表示，出發點就是國家面對危急時，看到烏俄戰爭告訴大家的，就是必須團結一致、奮力抵抗、一致對外。另外，外界認為國民黨充斥疑美論，前總統馬英九說美國只會提供武器並不會出兵？蔣萬安回應，對於歐美看到俄羅斯對烏克蘭的軍事行動，而沒有提供軍事援助，當然必須好好仔細分析研究，從當中學到寶貴的一課。由於國民黨各大老回應不符合主流民意期待，是否擔心影響年底台北市長選情？蔣萬安仍強調，譴責侵略行為，對於任何侵入領土行為都嚴厲譴責；大家都不願意看到戰爭發生，以對於和平反戰價值的堅持，台灣怎麼從當中學到寶貴一課，可以扮演什麼角色，是不是可提供人道協助、用科技戰略地位，盡國際社會一份子的心力，都可以來思考。
595,https://www.chinatimes.com/realtimenews/20220227001592-260410,戰火歷歷入眼簾 「避險資產」才是首選,財經,2022-02-27 12:50,俄羅斯進攻烏克蘭持續4天，引爆歐洲幾十年來最嚴重的國家安全危機。在網路無國界、視訊影像傳輸便利下，戰火訊息立即傳送到世界各地，國人彷彿親臨戰場，深刻感受避險的重要。外資匯商、外商銀行均表示，在一般民眾理解之前，全球法人資金已湧入避險資產，在股匯暴跌時保護資金部位的安全。FXTM 富拓市場分析師陳忠漢指出，「避險資產」是投資者與交易者在恐懼心理作用下蜂擁買入避險的資產，分析法人資金湧入的避險資產包括黃金、美元、日圓與瑞郎，以便於在不確定性增大時，推升此類資產價格傾向於上漲、或至少保持不變。陳忠漢說，俄羅斯入侵烏克蘭事件就是眼下最新的例子，「避險資產」在其它風險資產，如股票、新興市場貨幣等出現暴跌時，保護投資者與交易者的資金安全。戰火發生至今，以黃金表現最佳，優於其他避險資產。在眾多亞幣當中，日圓也在俄羅斯入侵烏克蘭當日強烈反映，美元兌日圓站上關鍵支撐的50天均線，後市可望測試100天均線。同樣基於避險目的，法國巴黎銀行財富管理偏好「另類投資」，項目多是低波動性投資產品，像是絕對收益債券基金、低波動性的另類 UCITS 基金策略，和浮動利率債券和信貸基金。法巴銀財富管理指出，工業金屬也有避險效果，但重點在對抗通膨、不是低波動。該團隊對於工業金屬和貴金屬保持樂觀，尤其是白銀和白金。歷 史上的低庫存和供應中斷的風險，可能會鼓勵對於貴金屬的投機行情。
596,https://www.chinatimes.com/realtimenews/20220227001665-260405,網紅闖俄烏戰地開直播「新鮮彈孔」下秒身後突爆炸嚇歪,生活,2022-02-27 13:52,俄烏24日開戰至今，已有許多人緊急撤離，不過一名大陸網紅「雪茄哥」竟到烏克蘭開直播，像介紹觀光景點般地說明民宅上的「新鮮彈孔」，直到他聽到身後不遠處傳來炸彈聲，才意識到危機，一度向大陸使館求助，不過至今他仍在烏克蘭，並持續用直播來報平安，他一臉擔憂地說「我現在進退兩難，一切只能聽天由命了」。雪茄哥在擁有近260萬粉絲，23日他特地從烏克蘭首都基輔搭火車到前線戰區頓內次克，全身上下沒有任何防護裝備，僅穿了一件長版羽絨外套，直播時他稱自己已來到「世界焦點」，並介紹烏克蘭的防空洞及民宅上的彈孔，還強調「這是新鮮的彈孔」，吸引上萬名網友觀看，不少網友批評「真的很大膽，根本是在玩命」，但雪茄哥卻回嗆「有什麼好怕的」。隨著局勢愈來愈緊張，25日「雪茄哥」直播時身後突傳出巨大的爆炸聲響，讓他嚇得趕緊向大陸使館求助，隨後他也再度開啟直播語帶哽咽，「我現在已經感覺這個地方很危險了，在大使館的幫助下，會有車子來接我，把我送到安全的地方」，並呼籲所有人都要好好保護自己。不過從雪茄哥的來看，直到今（27）日他仍未離開烏克蘭，期間他不斷地開直播，分享自己的現況。在最新影片中，他在空無一人的街上，四處不斷傳來爆炸、槍擊聲，只見他緊皺眉頭說，「現在雙方交鋒非常激烈，我現在進退兩難，也不知道該怎麼辦？一切只能聽天由命了。」13段直播影片曝光，讓不少網友傻眼，「别人都躲遠遠的 ，你是哪裡有危險就往哪裡跑」、「直接變戰地記者了是嗎？」、「早點回來吧！别給大使館添亂了」、「這樣直播是能賺多少錢，還給國家添亂」、「根本是在玩命」、「已2小時沒更新影片了，你還活著嗎？」、「你一定後悔去了吧」。
