,url,title,category,up_datetime,content
0,https://www.chinatimes.com/realtimenews/20220303005479-260410,烏克蘭危機令利率下跌 有助美國房市回穩,財經,2022-03-03 20:49,美國30年期固定房貸利率2月中升破4％創2019年10月來新高後，令2月底房貸需求停滯。但俄羅斯入侵烏克蘭令美國利率急跌，使30年期利率跌破4％，有助重振房貸需求回升而讓房價繼續漲。據房貸資訊網Mortgage News Daily資料，30年期利率2月25日達4.18％，但1日已拉回至3.9％。烏克蘭危機促使資金轉向債市避險，美國10年期公債殖利率一周內從接近2％急跌至低於1.9％。債價上漲代表價息下跌。美國債息走勢會連帶影響房貸利率隨之漲跌。美國抵押貸款銀行協會（MBA）2日公布上周（迄2月25日止當周）房貸申請案數量跟前周基本持平，這跟房貸利率走高有關。房貸利率持續走高，上周30年期利率較去年同期高出將近1個百分點，讓之前已鎖住較低利率的房貸戶沒有轉貸需求。轉貸目的是尋求更低房貸利率，通常在利率走低時才有轉貸需求。雖然上周申請轉貸案件數量較前周增加1％，但跟去年同期相較仍大幅減少56％。上周轉貸占整體房貸比率從前周50.1％下降至49.9％。高房價和房市待售物件嚴重不足，也令住宅買家繼續裹足不前而減少房貸申請數量。上周申請房貸去買房的數量較前周下跌2％，較去年同期減少9％。這跟高房價有莫大關係。資料供應商CoreLogic最新資料顯示美國1月房價年增約19％，為逾四十五年來最大增幅。這導致全美平均每件房貸申請金額上升至45萬4400美元再創新高。外界認為30年期利率開始拉回能增加買家的負擔能力，有助美國房價繼續走高。雖然聯準會仍未有改變今年升息與縮減資產負債表的計劃，房貸利率下跌可能是短暫現象，但目前房貸利率仍偏低和房市供不應求等會繼續推升房價。
1,https://www.chinatimes.com/realtimenews/20220303005225-260408,憂陸趁俄烏戰爭攻打台灣 西方軍情首長承認了,國際,2022-03-03 19:50,「加拿大廣播公司」（CBC）報導，加拿大軍情司令部（Canadian Forces Intelligence Command）司令2日承認，西方國家先前「非常擔心」中國大陸會在俄烏戰爭時趁機武力犯台，但相信北京政府已注意到西方國家對侵略行為的激烈反應，願意暫時打消其計畫。加拿大軍情司令部司令萊特（Mike Wright）少將2日出席加拿大眾議院國防委員會的聽證會，在說明烏克蘭局勢時，他承認盟國國防情報機構1週前「非常擔心中國大陸」，認為北京政府可能以東歐衝突做為掩護，趁機加快自己進一步控制海外的計畫，「特別是台灣」。CBC指出，雖然在俄羅斯實際入侵烏克蘭前，便已有許多安全與情報專家提及中國大陸可能與該國互相掩護、趁機進行武力犯台的風險，但萊特是首位公開承認有此威脅的高階情報官員。萊特指出，他相信與俄羅斯結盟的中國大陸，已經注意到民主國家，特別是北大西洋公約組織（NATO）與西方世界的反應，希望這能讓北京政府暫時打消其計畫。在俄軍持續於烏克蘭邊界集結期間，美國智庫「德國馬歇爾基金會」（German Marshall Fund of the United States）副總裁勒瑟（Ian Lesser）曾警告，北京政府可能選在東歐衝突爆發時攻擊台灣；不過退役美國陸軍中將、曾擔任駐北京武官的前國防安全合作署（Defense Security Cooperation Agency）署長胡可成（Charles Hooper）則認為，烏克蘭和台灣同時面臨攻擊的可能性不大，因為北京正「非常仔細地關注當前局勢」，觀察其他國家的反應、吸取教訓，並將其納入自己的戰略中，不會急著與俄羅斯同步發起軍事行動。
2,https://www.chinatimes.com/realtimenews/20220303005967-260417,俄羅斯警告動用核武 美軍這舉動安靜回應,軍事,2022-03-03 23:27,《空軍雜誌》（Air Force Magazine）報導，美國國防部發言人2日宣布，為證明該國為「負責任的核武大國」，美軍已決定推遲原定於本週進行的LGM-30G義勇兵3型（Minuteman III）洲際彈道飛彈試射演習，降低美國及俄羅斯雙方對情勢出現誤判的風險。根據報導，美國國防部發言人柯比（John Kirby）2日於記者會中表示，國防部長奧斯汀（Lloyd Austin）認為，由於目前情勢緊張，應降低美俄出現誤判的風險，故下令推遲原定於本週進行的義勇兵3型洲際彈道飛彈試射，強調美國無意進行任何可能導致誤會的行動。柯比表示，美國與俄羅斯不一樣，並未輕易做出以核武進行挑釁的危險行為，證明美國是「負責任的核武大國」，也強調延後試射的原因與武器戰備狀態無關，美國仍有信心守護所有盟國。俄羅斯總統普丁（Vladimir Putin）在入侵烏克蘭初期遭遇挫折、且被西方國家嚴厲制裁與聲討之下，2月27日宣布戰略部隊提高警戒狀態，加上其曾暗示，若西方介入烏克蘭衝突，有意動用核武反制，引發各界批評俄羅斯故意讓情勢升級；美國國務卿布林肯（Antony Blinken）2日也痛批普丁的挑釁言論「極度不負責任」。柯比還在記者會中表示，從佔領區域來看，俄軍針對烏克蘭首都基輔（Kyiv）、第二大城哈爾科夫（Kharkiv）的北面攻勢，在過去24至36小時內「並未取得任何顯著進展」，認為俄軍正重新組織攻勢，並評估如何發起下一波進攻。
3,https://www.chinatimes.com/realtimenews/20220303004792-260409,西方全面經濟制裁俄羅斯 中國僅能提供極有限協助,兩岸,2022-03-03 18:15,在西方向俄羅斯祭出經濟制裁之際，外界預期中國將會向莫斯科伸出援手，不過分析人士仔細檢驗後認為，中國缺乏全面出手的能力和動機，能真正幫得上的範圍很有限，恐怕難以有效幫助俄羅斯緩解經濟壓力。《美國之音》報導，北京當局一直未正面譴責俄羅斯入侵烏克蘭的行為，但未加入對俄羅斯的經濟制裁，僅呼籲俄烏兩國進行談判，這種模擬兩可的態度讓中國在國際社會受到非議。專家認為，中國可能通過貿易和金融手段有限度地支持俄羅斯，但不會冒著與西方關係徹底破裂的風險公開違反制裁。報導說，增加貿易進口是中國最可能援助俄羅斯的一個領域，但這些措施要數年才能見效。在入侵烏克蘭之前，俄羅斯總統普丁為冬奧會來到北京，兩國領導人在高調會晤後發表聯合聲明稱兩國的戰略合作「沒有上限」。期間雙方達成高達1175億美元的石油和天然氣交易，以及俄方向中國出口200億美元的煤炭。在俄羅斯對烏克蘭出兵後，中國也同意放寬對俄羅斯小麥的長期限制。中國和俄羅斯近年來有意加大了貿易聯繫，幫助俄羅斯減輕西方長期制裁的損失。2014年俄羅斯因吞併克里米亞被制裁後，中俄雙邊貿易擴大了50%以上。中國已經成為俄羅斯最大的進口來源國和出口目的地，兩國貿易在2021年達到創紀錄的1469億美元，同比增長36%。報導表示，雙方簽署的能源協定可以減輕莫斯科經濟上的痛苦，但石油協定為期10年，恐怕緩不濟急，天然氣協定所需要的新管道則要到2026年左右才能投入運營。戰略與國際研究中心高級副總裁路易斯(James Lewis)指出，歐洲才是俄羅斯能源的主要買家，中國難以填補西方退出的空缺。據世界銀行的數據，中國和俄羅斯在全球經濟中的份額遠低於本次對俄施加聯合制裁的7國集團。2020年中國占全球GDP的17.3%，而俄羅斯為1.7%，7國集團為45.8%。報導指出，中國可以幫助俄羅斯繞過美國主導的金融體系SWIFT，但這麼做會造成中國自身的風險。中國可以幫助俄羅斯使用人民幣為基準的跨境支付系統(CIPS)，但CIPS處理規模有限，只能用於與中國的交易。各國銀行也不太可能為了與俄羅斯的銀行交易而轉向CIPS，而且CIPS交易仍有很多部份要依賴SWIFT，同也有被西方制裁的風險，最終會形成CIPS只能用於中俄貿易。儘管俄羅斯央行對西方制裁早有防備，一直在擴大其外匯和黃金儲備規模，但美元和歐元仍占其外匯儲備的50%以上，約20%是黃金，人民幣占13%。法國外貿銀行亞太區首席經濟學家艾西亞(Alicia Garcia Herrero)在一份分析報告中預測，俄羅斯的人民幣儲備可能會在一年內耗盡，特別是在雙邊貿易擴大的情況下。但專家指出，中國大型金融機構違反制裁的成本太高。目前中國四大銀行需使用美元結算系統，但是最大的兩家銀行─中國工商銀行和中國銀行已經停止簽發購買俄羅斯商品的融資。
4,https://www.chinatimes.com/realtimenews/20220302002933-260407,支援烏克蘭！朱立倫：黨務一級主管捐1個月所得,政治,2022-03-02 14:39,俄烏戰爭延燒，國民黨主席朱立倫今天強調，國民黨要和平反戰爭的立場堅定，譴責俄羅斯侵略，同時聲援烏克蘭，黨務一級主管將捐出一個月所得，透過紅十字會來提供烏克蘭醫療資源。國民黨下午舉行中常會，廳上掛起「聲援烏克蘭、要和平、反侵略」的布條，配色也是烏克蘭國旗的顏色，朱立倫針對俄烏戰事發表談話，他說，俄烏戰爭今天進入第7天，烏克蘭陷入戰火，民眾、軍人因而喪生、受到傷害，國民黨早在第一天爆發戰爭時，就發聲明譴責俄羅斯的侵略，也聲援烏克蘭。朱立倫強調，國民黨希望和平，不希望有戰爭，要和平、反戰爭是堅定的立場，同時也應有具體的行動，昨天國民黨婦女部在平溪為烏克蘭民眾放天燈祈福，對於戰火中受到傷亡的烏克蘭民眾，國民黨一級主管將捐出一個月所得，支持烏克蘭醫療所用，透過紅十字會對烏克蘭盡速提供醫療資源。朱立倫指出，國民黨一再強調和平的重要，希望用對話代替對抗、用交流取代交惡，唯有如此，才有可能讓區域和平與世界和平能穩定下來，面對全球局勢，更要堅定自立自強，同時要堅定國家安全、自主國防安全。他提到，立院開議前，國民黨特別重視國家安全，將兵役法與後備軍人的修法列入優先法案，相信捍衛中華民國，必須有完整的兵役與後備軍人制度，也給予軍人更多支持。他再次強調，國民黨的主張就是捍衛中華民國、堅持民主自由、保衛國家安全、維護區域與兩岸和平，期盼朝野共同協力推動修法。
5,https://www.chinatimes.com/realtimenews/20220302002797-260405,烏克蘭畫家心繫祖國 盧秀燕祈願速停戰,生活,2022-03-02 14:35,俄烏戰火未休，定居台中市清水區的烏克蘭藝術家伊凡‧葉何羅夫，畫筆下的台中景色，伊金黃的稻穗、翠綠的田埂小徑，紅磚矮房在碧藍天空下，看見美麗的台中，台中市長盧秀燕表示，與大家一起為烏克蘭祈禱，祈願儘速停戰，終結爭端，止息死難，撫慰悲傷。「這是烏克蘭藝術家伊凡‧葉何羅夫畫筆下的台中景色」，伊凡夫妻日前來台中市府拜訪，分享畫作並表示希望未來能透過繪畫，讓更多人看見台中的美好。盧秀燕説，非常感謝烏克蘭籍的伊凡，讓各界看見台中。伊凡在台結婚定居，隨著妻子移居故鄉台中清水，清水小鎮常是畫作中的主題。盧秀燕與伊凡訪談過程中，聊到他的故鄉烏克蘭，以及曾生活過的城市基輔。盧秀燕表示，可以感受到伊凡與妻子的擔憂，但不幸結果還是發生了戰火，「戰爭不只摧毀城市，也埋下仇恨的種子」。「與大家一起為烏克蘭祈禱」，盧秀燕祈願盡速停戰，終結爭端，伊凡在台中居住能感受台中溫暖的人情味，發揮更多的繪畫才華，畫出更多的作品。
6,https://www.chinatimes.com/realtimenews/20220302004868-260408,西班牙土耳其向烏克蘭提供軍備 協助抵禦俄軍,國際,2022-03-02 21:07,西班牙總理桑傑士今天宣布，將向烏克蘭提供「攻擊性軍事裝備」。烏克蘭國防部長列茲尼科夫也稱，已準備好接收多國提供的刺針飛彈、標槍飛彈等武器援助。桑傑士（Pedro Sanchez）在國會宣布：「我想告訴大家，西班牙也將向烏克蘭反抗力量提供攻擊性軍事裝備。」他批評，俄羅斯總統蒲亭入侵烏國的決定是「野蠻的企圖，目的是阻礙（我們）建立價值觀與他所代表的專制主義截然相反的歐洲空間」。昨天，西班牙宣布增派150名士兵前往拉脫維亞，加入北大西洋公約組織（NATO）在波羅的海地區的集結行動。烏克蘭防長列茲尼科夫（Oleksii Reznikov）今天也說，土耳其將運送新一批無人機，援助烏軍抵禦外侮。烏俄開戰迄今，美國、加拿大和10餘個歐洲國家已針對烏克蘭的要求提供各式軍備。
7,https://www.chinatimes.com/newspapers/20220303000244-260206,操盤心法－台股步入箱型整理 選股優於選市,證券．權證,2022-03-03 04:10,"國際經濟情勢：俄烏戰爭至今有一周，隨著西方國家加大對俄羅斯制裁的力度，迫使俄烏雙邊走向談判桌，原先市場就此預期戰事之於國際股市的衝擊將可漸告段落，只是一來烏克蘭向歐盟申請加入的求救舉動，或被俄羅斯以違反停火條件視之，有礙談判的進程。伴隨戰事帶來的高油價，如今再因制裁行動封鎖俄國原油的出口而飆升，而與俄羅斯同為OPEC成員國的產油國亦雙手一攤，導致最後OPEC+仍決議溫和增產的步調，對當前飆漲的油價似乎更無阻力，並有助帶動市場做多商品的情緒，近日原油、部分俄烏地區產出的金屬、農產品等價格漲勢已相當驚人，只是對比現階段基本面才初現復甦的跡象，生活成本過高肯定有礙消費力。唯一有利市場的消息是央行應當會放緩走向政策正常化的進程，為此提醒投資人留意聯準會（Fed）主席鮑爾在出席本周聽證會的談話內容，看看Fed對俄烏局勢的反應如何－到底戰爭的不確定性是換來政策喘息的時間窗口、還是繼續側重強調高通膨的風險。只要俄烏和局難解，市場對高物價的擔憂就更根深蒂固，雖說有助營造一個類似再通膨的交易環境，然缺乏成長性也易使指數陷入難以突破的鍋蓋鐵板格局，這時選股的重要性更高。投資策略：台股歷經上周俄烏開戰導致大盤重挫的恐慌情緒後，本周隨著利空鈍化與上述總體局勢的改變，短線指數迎來偏多整理行情，多方應將上周回測的半年線視為重要防守關卡。但短底確立的同時，也需考量近期國際地緣變數充斥，盤勢波動仍大，另觀察萬八大關形成多道均線糾結的型態，容易被視作技術面的壓力，將壓抑盤勢的回升空間，建議操作上以短進短出做為因應，同時也須多留意成交量能，以今年以來行情，指數站上所有均線若無當日成交量能滿足3,000億元的支持，則代表指數位階已經近波段高點，宜逢高陸續調節持股。投資主軸上，在電子股部份，考量台灣半導體業者安全庫存約6個月，若戰事能於不致過長並影響半導體、記憶體廠等供應鏈，則電子股整體營運動能依舊相對有撐，惟價格上揚將造成生產成本增加，須提防中下游廠商財報利潤的壓力。參考近期法說會各公司釋出的營運展望，建議布局受惠高速運算應用的ABF族群、以及半導體大趨勢嘉惠的IP股、與報價預期走強的記憶體，也看好板卡、封測等高殖利率族群。傳產股方面，近日鋼鐵類股連三揚，主要是反映國際商品行情、與基建復甦拉動需求的有利情勢，再加上中鋼宣布配發3.1元現金股利具高殖利率題材，相關鋼鐵股值得留意。新能源車概念股長線趨勢不變，更是高油價下危機入市的好選擇，另受益於疫後復甦題材，並排除近日漲幅已大的內需股，預期成衣、鞋材等概念股在籌碼整理後，加上客戶端的國際大廠應當會於3月下旬發表財報的同時做出相對正面的業績指引，有助該族群評價重獲市場青睞。"
8,https://www.chinatimes.com/newspapers/20220303000115-260202,俄烏戰火，燒出原物料漲價潮 成本漲翻 食品廠譜驚魂記,財經要聞,2022-03-03 04:10,"俄烏大戰引爆農糧通膨，小麥、棕櫚油等食品原物料價格失控，國內油脂、烘焙廠叫苦連天，直呼太離譜！由於產品漲價速度跟不上成本飆升，包括福壽、福懋油、南僑、聯華等相關食品廠，短期獲利將面臨極大考驗。■各類食品原料全面上漲食品業者表示，照理說農糧價格有一定的Cycle（循環），上上下下，但這兩個月實在太離譜，幾乎每天都在創歷史新高。由於俄烏大戰爆發，包括黃小玉、棕櫚油、糖、奶油等各式食品原料全面齊漲，漲幅不是幾趴、而是翻倍漲，根本沒人受得了。業者指出，現在已經不是產品漲不漲價的問題，這一波就算政府想要凍漲也凍不住。最近的原物料價格漲得又急又猛，幾乎是一日三市，而廠商就算漲價，也不可能每天漲，售價完全跟不上成本飆升的速度，成本沒辦法完全轉嫁，一定會有落差，包括油脂、烘焙廠等，短期獲利將面臨極大考驗。由於俄羅斯、烏克蘭都是農產大國，戰事爆發，嚴重打亂全球農糧供應，加上市場預期心理，3日美國小麥期貨價格已經飆破每蒲式耳10美元，直逼2008年的歷史天價，短短兩周波段漲幅超過25％。棕櫚油價格更是飆速，2日吉隆坡棕櫚油現貨價格再衝破8,000馬幣大關，短短兩周波段漲幅直逼四成，續創歷史新高，這個數字比起2019年價格2,000多馬幣，已足足漲了快三倍。■低價麵包將不可能存在食品業者私下表示，不論麵包、泡麵、饅頭通通要用到麵粉、棕櫚油等，成本漲成這樣，終端的烘焙、餐飲業者終究得漲價，接下來10元的低價麵包不可能存在，消費者恐怕要有勒緊褲帶的心理準備。福壽董事長洪堯昆表示，接下來觀察重點在於俄烏大戰要拖多久？會速戰速決或長期抗戰，將影響國際原物料的價格走勢。■獲利恐面臨極大考驗食品業者說，食品原料有存放期限，久了會酸敗，而且油槽、穀倉等儲存空間有限，一般庫存頂多三、四個月，想要堆更多原料也沒辦法，俄烏大戰時間一旦拖長，等低價庫存用完，以現在直上天際的原料價格，根本沒人吃得消。"
9,https://www.chinatimes.com/newspapers/20220303000292-260206,匯率期貨趨勢專欄－俄烏戰事升溫 美元看多,證券．權證,2022-03-03 04:10,"俄羅斯與烏克蘭戰事持續升溫，俄羅斯總統普丁搬出核武威脅，引發市場對戰爭恐升級至核戰等級的擔憂。近期歐元表現疲軟，匯率市場隨俄烏情勢發展呈現大幅波動，美元指數持續震盪走高，近月分美元指數期貨價格3月1日收盤收在97.406點，創2020年7月以來收盤價新高水位。根據美國商品期貨交易委員會（CFTC）公布的籌碼數據觀察，截至2月22日為止，槓桿基金持有歐元／美元期貨淨空單30,585口，淨空單較前一周減少6,437口、日圓／美元期貨淨空單38,330口，也較前一周減少9,551口、澳幣／美元期貨淨空單32,478口，變化不大，而在英鎊／美元期貨為淨多單3,307口，淨多單減少6,066口，整體投機資金仍維持看多美元部位，看空歐元及日圓空單部位出現減碼情況。國泰期貨證期顧問部分析師吳品杉表示，俄烏戰爭不僅重創俄羅斯及烏克蘭經濟，同時也對歐洲甚至全球造成一定程度的影響。金融面來看，各國持續對俄羅斯出爐的經濟制裁手段將對俄羅斯造成沉重的經濟負擔，甚至部分俄羅斯銀行遭SWIFT剔除，制裁行動不僅對俄國企業或銀行造成衝擊，與之來往的全球銀行企業，也將同樣遭受資產減損的影響。整體來看，俄烏戰爭對市場造成不確定性逐漸增加，然而不論戰事能在可控範圍內落幕或是戰情繼續溫升，對歐洲經濟的負面影響都相較其他地區為大，此外，物價上漲壓力，促使聯準會升息壓力增加，對歐元走向呈現不利的影響，因此，操作上維持對美元指數偏多看法不變。（國泰期貨提供，李娟萍整理）"
10,https://www.chinatimes.com/newspapers/20220303000448-260114,烏俄戰爭航班亂 挪威鮭魚價增3成,生活新聞,2022-03-03 04:10,烏俄戰火恐引爆鮭魚之亂，未來消費者想到日本料理店吃鮭魚生魚片、鮭魚握壽司，已經不是荷包縮水問題，恐怕有錢也吃不到！台中市傳統市場一家百年魚貨店透露，戰爭已讓挪威進口鮭魚價格飆30％，最近還收到進口商通知下周無法正常供貨。台灣進口鮭魚產地相當多元，除挪威外，英格蘭、加拿大、日本、智利等地都有鮭魚，烏俄戰爭讓歐洲產地的鮭魚因船期、航班大亂，供貨出現問題，其中以挪威鮭魚漲幅最高，國內大型餐飲集團如漢來美食、築間餐飲集團都積極研擬因應對策，目前暫不考慮調漲相關商品售價，如找不到替代性商品，不排除暫停供應。漢來美食行銷企畫部副總吳若寧坦言，如烏俄戰爭持續，進口鮭魚恐將斷貨，漢來美食全省17個品牌、44家分店，每月鮭魚用量約1400公斤，所有餐飲使用的就是挪威進口鮭魚，目前供貨還算穩定，但上月和3月的進貨單價已從每公斤425元漲到515元，漲幅近2成。築間餐飲集團公關部經理高林禎指出，該集團全台6個品牌、102家分店，每月鮭魚平均進貨量超過6噸，全採用南美洲智利的鮭魚，目前供貨未受影響、價格還算持平，目前也密切注意進口水產和肉品供應狀況。民進黨前國際部副主任、台中市議員參選人陳俞融指出，烏克蘭是「歐洲糧倉」，世界第五大糧食出口國，是小麥、玉米的重要出口國，戰爭若持續升溫，除了能源價格受影響，小麥、玉米價格同樣可能上漲；而台灣因進口需求，原物料價格調漲牽動成本走高，可能導致「輸入性通膨」發生。陳俞融不諱言，在走訪市場及店家，許多攤商及海產店指稱，台灣進口許多挪威鮭魚，挪威當地有非常多的烏克蘭移工，因為戰爭爆發，移工罷工甚或返鄉導致缺工，整個生產鏈受到影響，也因此造成台灣進口的挪威鮭魚短缺。
11,https://www.chinatimes.com/realtimenews/20220303005512-260410,車用訂單挹注 毅嘉2月營收創2015年以來同期最高,財經,2022-03-03 21:00,受惠於車用半導體零組件缺料略為紓緩、車廠客戶拉貨積極，即使2月受到農曆年假影響，毅嘉（2402）2月營收仍有5.2億元，是2015年以降同期最佳表現，月減幅度僅12％。而俄烏局勢對歐洲車廠客戶開工狀況與毅嘉車廠訂單會不會有影響，法人認為還需觀察。毅嘉表示，2月雖然受春節工作天數減少影響，但整體出貨在客戶需求帶動下，單月營收為5.2億元，目前車用市場晶片短缺的情況雖然仍未獲得解決，但預期將可逐步舒緩，來自主要客戶需求動能強勁，毅嘉全年度營收及獲利將可樂觀期待。俄國進攻烏克蘭帶來的供應鏈中斷，已經造成部分歐洲車廠又暫時停工，法人表示，毅嘉的最終端車載客戶以歐洲、美國居多，俄烏局勢對歐洲車廠開工狀況與供應鏈有沒有影響，還需持續觀察。
