,url,title,category,up_datetime,content
875,https://www.chinatimes.com/realtimenews/20220225004391-260407,全球戰力排名「台灣21、烏克蘭22」網看完大喊5字,政治,2022-02-25 19:00,俄羅斯24日出兵攻打烏克蘭，戰事進入第2天，據《美聯社》報導，烏克蘭軍方表示，俄羅斯軍隊喬裝成烏克蘭軍隊、駕駛烏克蘭軍車的間諜「破壞者」距離基輔只有3英里（約4.8公里）。眼見俄烏雙邊軍事戰力懸殊，有台灣網友翻出2022年全球軍力排名，俄國排行第2、中國大陸居第3、台灣第21名，而烏克蘭為22名。對此，有網友表示「我們有掃把」。一名網友24日在PTT貼出「2022年全球軍力排行」，該排名是由知名軍事網站「全球火力」(GlobalFirepower GFP)公布的「2022年軍力排名」(2022 Military Strength Ranking)，2021年全球140個國家中，台灣火力指數以0.3215在全世界排名第21位；不但超越加拿大(排名23)，更大勝北韓(排名30)，但遠輸給大陸。2022年軍力排名是以2021年相關資料為依據，前5名依序為美國(火力指數0.0453)、俄國(火力指數0.0501)、中國大陸(0.0511)、印度(火力指數0.0979)與日本(火力指數0.1195)。至於台灣，台灣的火力指數為0.3215；比排名第23的加拿大(火力指數0.3601)、第30名的北韓(火力指數0.4621)還來的高，遠遜於第4名的印度及第3名的大陸。相較於「2021年軍力排名」，儘管台灣由第22名上升到第21名，但GFP評論卻認為，2022年的台灣軍力價值是呈現倒退的趨勢。在GFP的軍力排名中，除了傳統的軍隊人數、火砲數、艦艇數、戰機數等傳統武力外，也納入自然資源(如石油產量、儲備量)、後勤能力(如勞動力、道路覆蓋率、鐵路覆蓋率、商船船隊規模、港口數)、金融能力(如外匯/黃金與購買力準價)等項目，使得部分小國的軍力排名得以超越國土大、卻發展不佳的國家。對此，有網友留言表示「美國不幫台灣當然撐不了多久」、「你覺得國軍跟常打仗的烏軍哪個強？」、「幾天有差嗎？」、「海島兩棲登陸已經很難，更不要說台灣」、「台灣有台灣海峽、颱風、海島地形」、「有台灣海峽可以撐久一點，但登陸後直接投降」、「我們有掃把」。
876,https://www.chinatimes.com/realtimenews/20220225004900-260409,習普就烏克蘭問題通話 專家警告：西方正千方百計挑撥中俄關係,兩岸,2022-02-25 21:24,中國國家主席習近平與俄羅斯總統普丁通話，各國對中方在俄烏戰爭上的立坦極為關切。中方表示將根據烏克蘭問題本身的是非曲直決定中方立場，並尊重各國合理安全關切。中俄專家指出，美國和澳大利亞等西方國家對中國態度當惱火，不擇手段地找藉口，要在烏克蘭問題上逼迫中方採取守勢，並千方百計挑撥中俄關係。據大陸《央視》報導，習近平在與普丁通話中指出，近期烏克蘭東部地區局勢急劇變化，引起國際社會高度關注。中方根據烏克蘭問題本身的是非曲直決定中方立場。要摒棄冷戰思維，重視和尊重各國合理安全關切，通過談判形成均衡、有效、可持續的歐洲安全機制。俄羅斯《衛星通訊社》則指出，澳大利亞總理莫里森批評中國在俄羅斯對烏克蘭特別行動時取消了俄羅斯小麥進口的限制。他稱中國的這一立場是「不可接受的」，澳大利亞正與美國、歐洲和日本一道採取措施將俄羅斯與世界隔離開來。白宮發言人薩琪也喊話，希望中國要考慮到「現在想站在歷史的哪一邊」。中國國際問題研究院研究員沈世順受訪時表示，美國要求中國站在他們一邊，以加大對俄羅斯的壓力，這對中國來說是一種不可接受的冷戰思維。「由於美國和北約長期以來不斷東擴，擠壓俄羅斯的戰略空間，嚴重突破底線，迫使俄羅斯不得不採取反應措施。實際上中俄作為戰略協作夥伴關係，在很多方面有著共同的戰略利益，是來之不易的良好關係。」俄羅斯國家全球安全研究所所長阿納托利．斯米爾諾夫認為，在與烏克蘭危機相關的新形勢下，美國及其西方盟友正在按照「分而治之」的舊原則行事。他說：「西方長期以來一直在千方百計挑撥中國和俄羅斯的關係，現在烏克蘭危機正在被利用。美澳為了削弱中俄戰略夥伴關係，在烏克蘭問題上逼迫中方採取守勢，不擇手段地找藉口。西方顯然對中國在烏克蘭問題上的獨立立場感到惱火。」中國人民大學國際事務研究所所長王義桅受訪時指出，圍繞烏克蘭的危機是對美國和西方國家不尊重俄羅斯安全問題的反應。他說，「當前中俄全面戰略協作夥伴關係是新型大國關係的典範。烏克蘭危機局勢的走向正是因為俄羅斯在安全問題上的合理關切不被美西方國家尊重，迫使俄羅斯不得不採取最激烈的反應措施。」王義桅指出，西方在烏克蘭危機中扮演著不負責任且挑撥離間的角色。美國不斷推動北約東擴，首先是基於軍工集團利益的考慮，以推銷自己的軍火和武裝設備。其次美國在歐洲安全議題上不斷製造麻煩，造成了俄羅斯和歐洲國家的不信任，產生分裂和對抗。另外，北約東擴還破壞了已有的國際安全體系和歐洲的安全自主、互聯互通、能源建設，這種冷戰思維和軍備競賽模式已經造成了一系列的後果。
877,https://www.chinatimes.com/realtimenews/20220225003532-260408,人性光輝！加護病房被移到防空洞 烏克蘭醫護手動維持新生兒呼吸,國際,2022-02-25 16:06,戰火無情，在風雨飄渺之際，人性光輝令人感動。烏克蘭東部第聶伯羅市一家兒童醫院將新生兒加護病房移至臨時防空洞內，由於情況相當危急，醫療資源嚴重不足，醫護人員甚至只能透過手動方式維持新生兒呼吸，讓他們得以延續生命。每日郵報、紐約時報報導，第聶伯羅彼得羅夫斯克州兒童醫院（Dnipropetrovsk Oblast Children’s Clinical Hospital）新生兒加護病房主任Denis Surkov透過通訊軟體向外界揭露最新狀況，「這裡是新生兒加護病房，在防空洞裡，你能想像這樣的狀況嗎？這就是我們的真實情況，我們很緊張也很無助。」第聶伯羅是烏克蘭遭到俄羅斯砲擊的十幾個城市之一，由於市區被導彈襲擊，醫護被迫將病人移往防空洞，Denis Surkov提供一段由同事拍攝的影片，可以看到嬰兒被不同顏色的毛毯包覆，躺在臨時的病床上，一些小孩被醫護抱在懷裡，甚至有醫護手動幫小嬰兒維持呼吸，不過狀況相當有秩序，並沒有人哭泣。目前俄羅斯軍隊持續往首都基輔進攻，並從北東南三個方向，以陸海空方式圍剿，美媒《新聞週刊》引述美方官員說法，評估烏克蘭首都基輔可能在96小時內被俄軍攻下，領導階層甚至會在一週內垮台。
878,https://www.chinatimes.com/realtimenews/20220225001181-260407,拜登稱「為烏克蘭人民祈禱」台網友炸鍋 宅神不解問這問題,政治,2022-02-25 08:58,俄羅斯與烏克蘭情勢連日緊繃，美國總統拜登昨特地在其推特發表聲明，希望全世界的人民一起來為烏克蘭祈禱，美國在台協會（AIT）也隨即在臉書分享這篇聲明，但卻引起台灣網友正反兩面看法。對此，宅神朱學恒直言，拜登都講了要替烏克蘭人民祈禱了，自己就不懂底下為何一堆台灣網友去苦苦相逼。針對烏克蘭和俄羅斯局勢，AIT昨（24日）在臉書PO出拜登總統的聲明，強調「全世界的人民今晚與烏克蘭人民一起祈禱，因為他們遭到俄羅斯軍隊無端和無理的攻擊。普丁總統選擇了一場有預謀的戰爭，這將帶來災難性的生命損失和人類苦難。俄羅斯要為此襲擊將所帶來的死亡和破壞負起全責，美國及盟國和夥伴將以整合和果斷的方式做出回應。全世界都將追究俄羅斯的責任」。不過，AIT的這篇PO文卻引發台灣網友正反兩面看法，有些網友表示，「烏克蘭加油」、「為烏克蘭祈禱」，另有網友認為，「很多人留言都是在講幹話」、「連基輔都開炸了，還在那邊祈禱，是要祈禱著魔鬼不要繼續伸出魔抓嗎？現在烏克蘭人最需要的不是祝福而是實質的協防」、「一堆人祈禱美國出兵而不是我們自己出兵，別人家的孩子死不完」？更有網友指出，「對台灣人來說，接連看到貴國在阿富汗跟烏克蘭的事件反應，不會再存有幻想，我們只能自立自強、自求多福吧」、「真是令人失望，身為最強大民主國家的領導人，結果只能祈禱？」「所以貴國好像也只能袖手旁觀對吧？在這邊祈禱，希望上帝能出手擊退俄國嗎」、「老天待台灣人不薄，讓我們看到了阿富汗，再讓我們看到烏克蘭的例子，這樣還看不清美國就辜負老天了」、「下一個被老美出賣的可能就是台灣了」。看到網友的評論，朱學恒也隨即在其臉書發文表示，「拜登都講了要替烏克蘭人民祈禱了，我就不懂底下為何一堆台灣網友去苦苦相逼」，許多網友也留言表示，「那些人好傻好天真，不想面對現實」、「如果我們有事、他應該也會幫我們祈禱」。
879,https://www.chinatimes.com/realtimenews/20220225002895-260410,協助抗俄 流向烏克蘭武裝組織的比特幣捐款大增,財經,2022-02-25 14:33,自俄羅斯周四向烏克蘭發動攻擊以來，向烏克蘭武裝組織的比特幣捐款就不斷攀升。根據區塊鏈分析公司Elliptic數據顯示，周四的12個小時期間，提供軍事援助的烏克蘭非政府組織Come Back Alive就收到將近40萬美元的比特幣。最新一輪加密貨幣捐款凸顯近期趨勢。根據Elliptic資料，近幾周有數十萬美元的捐款湧入烏克蘭非政府組織（NGO）和抵抗俄羅斯攻擊的志願隊。Elliptic科學長Tom Robinson指出，「在政府默許下，加密貨幣愈來愈常用於戰爭群眾募資。」Elliptic主要出售區塊鏈分析工具予銀行和加密貨幣平台。
880,https://www.chinatimes.com/realtimenews/20220225004059-260407,宣布與俄羅斯斷交！這國家表態挺烏克蘭 黃創夏吐一句,政治,2022-02-25 17:46,俄烏戰火持續展開，今天已邁入第二天，據外媒報導，位於西太平洋島國密克羅尼西亞聯邦(Micronesia)於25日宣布與俄羅斯斷交，並強烈譴責俄羅斯大規模發動軍事侵略干預。烏克蘭總統澤倫斯基（Volodymyr Zelensky）則表示對西方態度感到心灰意冷。對此，名嘴黃創夏忍不住直呼，「『南島民族』就是有Guts」。俄羅斯總統普丁（Vladimir Putin）下令對烏發動「特別軍事行動」後。位於南太平洋的島國，密克羅尼西亞聯邦今天公開宣布正式與俄羅斯斷絕外交關係，因為俄國「無恥的暴行」及「無來由的入侵行動」，並強烈抨擊表示:「密克羅尼西亞不會因此袖手旁觀、保持沉默。」這個堪稱世界上最安全的國家「密克羅尼西亞聯邦」以豐富的自然景觀成為旅遊勝地，主要分成四座大島，由607個小島嶼組成，島上總人口數大約10萬人，其官方語言為英語。黃創夏25日對此在臉書發文表示，「抗議邪惡的侵略！太平洋島國密克羅尼西亞開第一槍：宣布和俄羅斯斷交，『南島民族』就是有Guts」
881,https://www.chinatimes.com/realtimenews/20220225001436-260408,淚送家人到安全區！烏克蘭爸告別女兒留守抗戰 43秒影片曝光,國際,2022-02-25 09:40,俄羅斯開始全面進攻烏克蘭，許多城市遭到攻擊。網路流傳一段影片，一名烏克蘭父親決定送家人到安全區，自己獨守抗戰，過程中父女倆相擁而泣，最後父親手貼車窗不捨的目送妻女搭接駁車離開。推特流傳這段影片中，一名烏克蘭父親在接駁車前與穿著粉色外套的女兒相擁，他紅著鼻子，不斷親吻著女兒，替孩子整理頭髮，戴好帽子，接著父親單膝跪地，拉著孩子的手叮囑著，然後忍不住落下眼淚，女兒也跟著嚎啕大哭。最後一家三口擁抱告別，父親送上妻女上了接駁車，他站在車子外面，並將手放在車窗上，表情十分不捨，但卻只能看著妻女離開，自己則留下來為國家而戰。影片曝光，讓各國網友看了忍不住鼻酸，紛紛表示，「好難過」、「願世界和平」、「這畫面令人心碎」、「只希望這是一部電影，因為我根本不敢相信」、「人類文明演變至今，這種事情不該發生」、「對這父親不公平」、「身為人父，看到這幕好心痛」。
882,https://www.chinatimes.com/realtimenews/20220225001059-260407,俄烏之戰美國被看破手腳？他5字預言「西方霸主」危險了,政治,2022-02-25 08:24,俄羅斯24日宣布將對烏克蘭採取「特種作戰」並發動飛彈攻擊，烏克蘭目前已至少有10座城市淪陷。中山大學社科院前院長、現任民眾黨立委張其祿表示，此次烏東事件，美國多數行動口惠實不至，美國不僅將失去國際社會信任，對美國長期佔據的西方國際社會領頭羊角色也「確實有影響」，包括波羅的海三小國、中東歐的新民主盟邦國家，都會懷疑美國的支持究竟到不到位。張其祿24日接受香港媒體《中評社》訪問指出，從去年美國在阿富汗倉皇撤兵，到現在俄烏情勢的發展，美國作為西方民主盟國的頭，盟友們對其信任度確實遭衝擊。張其祿分析，烏克蘭情勢跟台灣有某種程度的相似性，都是夾在兩大強權之間，內部也有親美、親俄、親中等爭論。張強調，小國關鍵在於能否自立自強、保有自主性的自助，若只期待人助都非常不保險，必須讓自己擁有實力才是重點，像烏克蘭總統澤倫斯基也有點後悔當初烏克蘭信任美國而廢除核武。針對美國是否失去國際社會的信任？張其祿直言，此次烏東事件，美國多數行動口惠實不至，僅呼籲、制裁、要求同盟國給俄羅斯壓力，但卻沒有實質的協防等動作，這點對美國西方領頭羊的角色「確實有影響」，將衝擊非傳統的盟邦對美國的信任度，例如波羅的海三小國、中東歐的新民主盟邦國家等；但日本、韓國都是與美國關係較緊密的國家，實質上也有正式的安保關係，對美國的信任感則不太會受到影響。
883,https://www.chinatimes.com/realtimenews/20220225001818-260407,美國會不會出兵援烏？郭正亮一句「神預言」 網全炸鍋,政治,2022-02-25 11:18,俄羅斯總統普丁24日宣布，在烏東頓巴斯地區進行進行特別軍事行動，外媒報導烏克蘭目前已至少有10座城市淪陷。針對美國和北約在俄羅斯攻烏後是否會出兵支援烏克蘭，民進黨前立委郭正亮直言「不至於會出兵」，因一旦出兵戰爭恐會沒完沒了。此說法引爆網路熱議，大批網友留言痛批美國只會出張嘴與賣武器，根本口惠實不至。郭正亮24日在《TVBS》政論節目〈新聞大白話〉表示，俄烏局勢惡化成這樣真的是悲劇，會演變成這樣，很大原因正是因為雙方不斷錯估和加碼的結果，烏克蘭接下來會怎麼做我們真的不知道。至於美國和北約是否會出兵支援烏克蘭？郭正亮認為，歐美接下來雖會發布新一波制裁，但是應該不至於出兵，因為一旦出兵，戰爭恐怕會沒完沒了，畢竟烏克蘭是一個很大的國家，60萬平方公里、4千多萬人口，而這麼多人口中有一些人是非常、非常反俄的，戰爭打到後面，會不會變成零散游擊隊？那就沒完沒了了，屆時普丁想立刻掙脫、想在48小時內收兵撤軍，恐怕雙邊都會陷入僵持。郭正亮預言美國不會出兵的說法引發熱議，網友湧入《中評社》與臉書相關連結留言：「歐美國家出張嘴，看吧！烏克蘭太相信美國，這就是下場，台灣呢？」「反正武器賣了就好，其他美國才不管勒」、「美國一直都這樣，只是台灣總有些人看不清」、「這就是美國」、「美國口惠實不至，說到底都是為了私利」、「不可能！絕對不可能！」「普丁不會甩你的，美國自阿富汗撤軍被俄羅斯看破手腳，美國現在是垂垂老矣的國際警察」、「郭正亮的評論和分析非常精準」。
884,https://www.chinatimes.com/realtimenews/20220225001804-260403,足球》名教練一家遭困基輔：祈禱炸彈不落在我們身上,體育,2022-02-25 11:27,俄羅斯在昨天向烏克蘭發動軍事攻擊，讓烏克蘭首都基輔與第二大城哈爾科夫陷入戰火之中，當地民眾紛紛逃難，過程實在太可怕了。而曾在烏克蘭超級足球聯賽球隊執教過的豐塞卡(Daniel Fonseca)曝光了基輔當地狀況，他們一家人現在都還被困在那！豐塞卡在接受媒體採訪時透露了當時慘況說：「清晨5點，我被連續5次爆炸聲给吵醒。本來我計劃坐早晨航班離開，但現在根本不可能離開了，因為機場已經被炸了、空域全被關閉，這是我生命中最糟的一天。現在我只能等待幸運降臨，並祈禱炸彈不會落在我們身上！」豐塞卡的一字一句都透露出基輔當地的可怕狀況，隨後他在社群上發了影片表示：「大家好。我在基輔。在一場無法接受的戰爭中，我和家人正經歷一段非常艱難時期。然而，我們相信和平最終會到來，我們必須保持強大。感謝大家的關心，希望很快見到所有人！」而豐塞卡的妻子則在IG發文痛斥這場戰亂：「這是有史以來最糟糕的早晨。疼痛、憤怒、憤怒、憤怒和痛苦。我的小兒子不該被捲入這場戰爭，其他在烏克蘭的孩子也一樣。」而妻子正是烏克蘭人，於2019年才生下孩子，當然不希望年紀小小的他得經歷這一切！
885,https://www.chinatimes.com/realtimenews/20220225004934-260407,俄烏開戰後 吳子嘉一句話預言結局 劉寶傑吃驚,政治,2022-02-25 21:36,俄羅斯總統普丁24日正式在烏克蘭東部發動「特種軍事作戰」，俄烏情勢也成全球關注焦點。對此，資深節目主持人劉寶傑詢問《美麗島電子報》董事長吳子嘉，普丁出兵的底氣究竟從何而來？烏克蘭怎麼這麼不堪一擊？吳子嘉分析，烏克蘭這局，普丁是吃定美國總統拜登，因為看準拜登不敢插手，換成是前總統雷根、甘迺迪他就不敢打了。劉寶傑驚訝表示「所以普丁現在是吃定了拜登？」。吳子嘉直言，事態發展將可能變成「長期冷戰化」的局面。吳子嘉24日在「關鍵時刻」表示，俄羅斯地面部隊攻入烏克蘭，表示是用美軍過去攻打伊拉克的模式，代表俄羅斯已經完全掌握空優，而俄羅斯在歐洲是第一大，也是最強的軍隊，所以普丁在戰前才很有信心的警告歐美各國，不要干預出兵烏克蘭這件事。節目主持人劉寶傑問吳子嘉，「讓他感到不解的是，普丁的底氣究竟從何而來？烏克蘭不是沒有部隊，但是怎麼會這樣不堪一擊？而且普丁還警告各國，不要插手，否則會進行報復，這是怎麼回事？」吳子嘉說，烏克蘭這局，普丁是吃定美國總統拜登，因為看準拜登不敢插手，換成是前總統雷根、甘迺迪他就不敢打了，因為當時這幾位前總統在位時，東西方陣營還是冷戰階段，但現在局勢今非昔比。劉寶傑驚訝反問：「所以普丁現在是吃定了拜登？」吳子嘉說，普丁斷定拜登領袖能力有問題，所以才斷然出兵烏克蘭，如果今天美國想出兵，俄羅斯敢打嗎？吳子嘉續指，任何戰爭的開端，都是建立在「花費成本」和「耗費時間」這2個基礎之上，其次，則是打下來後，統治成本的問題，普丁之後若攻佔烏克蘭，後面的高成本統治也是問題，因為烏東地區親俄，但烏西地區卻不是親俄的。不過，吳子嘉也說，現在能擋住普丁和俄軍的，只有美軍，但拜登現在不肯出兵，將軍隊都部署在第二線包括波蘭和波羅的海三小國，北約現在對俄羅斯的態度只會更壞不會更好，因此會更加團結。可預期的是，事態發展將會變成一個「長期冷戰化」的局面，但還是要觀察未來的變化。
886,https://www.chinatimes.com/realtimenews/20220225002946-260409,陸派包機撤僑 台港澳民眾也能搭 台青喊這句,兩岸,2022-02-25 14:54,中國駐烏克蘭大使館微信公眾號今天（25日）發布關於《請擬從烏克蘭撤離的中國公民進行登記的緊急通知》，除了持中華人民共和國護照者外，持台胞證的台灣民眾也能登記申請機位。一名自稱是台灣人的男子的知消息後，錄製一段影音上傳社交媒體，表示自己很感動，「台灣同胞要永遠愛自己的母親」。通知稱，擬從烏克蘭撤離的中國公民務必完整、仔細填寫表格，登記時間截止到當地時間2月27日周日晚12點，登記人員須持有中國護照或旅行證（含香港特區護照、澳門特區護照、台胞證，無護照人員須持有國內身分證）。後續安排請第一時間關注使館發布的通知。得知可以持台胞證申請搭乘大陸的撤僑包機，一名自稱是台灣人的男子錄製影片說出感想：「我剛剛看到一個通知，太感動了！中國駐烏克蘭使館發布通知，分批用包機接返中國公民，登記需要有中國護照或旅行證件就可以了。其中有一條包含台胞證。」男子情緒激動的說，「這讓我感覺到什麼？即使你不聽話，但也是我們的孩子啊！」此處不知為何，鏡頭劇烈抖動。男子接著說，「最後覺得，台灣同胞，你真的是要永遠愛自己的母親，真的是太偉大了！」
887,https://www.chinatimes.com/realtimenews/20220225005202-260410,美股早盤三大指數漲跌互見,財經,2022-02-25 23:05,地緣政治仍左右美股盤勢，在投資人觀望心理下，美股周五（25日）早盤3大指數漲跌互見，道瓊工業指數、標普500指數震盪走高，那斯達克指數開高走低。台灣時間22點45分，道瓊工業指數上漲209.23點（或0.63%），暫報33433.06點；那斯達克指數小跌21.03點（或0.16%），暫報13452.56點。標普500指數小漲19.65點（或0.46%），暫報4308.35點；費城半導體指數下跌9.80點（或0.29%），暫報3389.36點。蘋果、亞馬遜、微軟等5大科技巨頭股價普遍下滑，僅Google母公司Alphabet小漲1.51美元（或0.06%），暫報2654.98美元。台積電ADR下跌2.19美元（或1.96%），暫報109.69美元；聯電ADR也跌0.07美元（或0.6%），暫報9.17美元。俄軍對烏克蘭發動攻勢，奪攻佔車諾比 (Chernobyl) 核電站後，已逼近烏克蘭首都基輔。克里姆林宮25日聲稱，總統普丁準備派代表團前往白俄羅斯首都明斯克，與烏克蘭進行談判。美國則對俄羅斯祭出更嚴厲的制裁，鎖定俄國的國防、航太和海事產業。美國對俄國的出口管制涵蓋半導體、電腦、電信、資安設備、雷射和感測器等技術。在美國生產，以及使用美國的設備、軟體和藍圖在國外生產的產品，都包含在內。歐盟也計劃限制俄國使用半導體等重要技術。
