,url,title,category,up_datetime,content
294,https://www.chinatimes.com/realtimenews/20220301002236-260407,俄烏開戰之際拜登特使團來訪 游盈隆揭原因,政治,2022-03-01 12:50,拜登總統特使團今到訪；台灣民意基金會董事長游盈隆今表示，這個節骨眼來訪正是時候，因為「今日烏克蘭，明日台灣」的自然聯想，其重要構成因素之一就是美國的不積極作為。游盈隆指出，正當俄烏戰爭關鍵時刻，美國總統拜登特使團，今天下午搭乘行政專機專程訪台，一般咸認意義重大。明眼人都知道，此番拜登特使團來台，雖然只是卸任高層國安人員的組合，明的是表態支持台灣，暗的是要中共稍安勿躁，莫輕舉妄動。他指出，從台灣民意的角度看，拜登特使團來的正是時候。根據台灣民意基金會在俄烏開戰前夕所做的二月及時民調，顯示過半數台灣成年人對美國拜登總統處理烏克蘭危機是不欣賞的，或說是有疑問的。他說，上月底台灣民意基金會民調顯示，2成6基本上欣賞美國總統拜登決定即使俄烏開戰也不派兵進入烏克蘭的作法，5成1不欣賞，這項發現傳達了一個清楚的訊息，台灣人對美國總統拜登這項作為的反應，可以形容是「不約而同的群起譁然」。這明顯是一種台海軍事危機的心理投射，且這種感覺和判斷是跨政黨、跨族群、跨世代、跨性別、跨教育程度的，極為罕見。他指出，近期「今日烏克蘭，明日台灣」的傳聞甚囂塵上，不僅在台灣內部，也感染全世界，顯然有其客觀的社會心理基礎。若干深藍資深媒體人，以及國民黨籍立委吳斯懷等，趁機煽風點火，心態固然可議，但這把火苗能不能燒起來，並成燎原之勢，還是要看台灣內外主客觀條件而定。他表示，他不認為這把火燒的起來，台灣民心士氣短期內也沒有潰堤之虞。但拜登總統特使團在這個節骨眼來訪正是時候。因為「今日烏克蘭，明日台灣」的自然聯想，其重要構成因素之一就是美國的不積極作為。他認為，台灣人此刻最想知道的是，有一天，中共（中國）武力犯台，美國是否會比照對待烏克蘭的方式對待台灣？「我不預期特使團會對這問題給出明確答案」。
295,https://www.chinatimes.com/realtimenews/20220301000772-260407,拜登急派代表團3／2會蔡英文 網友一事察覺不對勁,政治,2022-03-01 07:55,總統府發言人張惇涵昨日（2月28日）證實，美國拜登總統指派跨黨派資深代表團，將於3月1日至2日搭乘行政專機訪問台灣。總統蔡英文預計將在3月2日於總統府接見訪團，雙方將就台美關係及國際區域局勢等各項重要議題深度交流。此事引發網友熱議，有網友認為，俄烏戰爭十萬火急美國不趕快去協助烏克蘭，反而跑來台灣，背後一定有玄機，甚至懷疑上次要台灣吞萊豬，這次恐又有新條件？張惇涵表示，此次將由美國前參謀首長聯席會議主席穆倫（Michael Glenn Mullen）率團訪台，訪團成員包括：前國防部政策次長傅洛依（Michèle A. Flournoy）、前白宮副國安顧問歐蘇莉文（Meghan L. OSullivan）、前白宮國安會亞洲事務資深主任葛林（Michael Green）及前白宮國安會亞洲事務資深主任麥艾文（Evan S. Medeiros）；訪團成員涵蓋民主、共和兩黨的卸任高層國安官員，可見美國對台灣的高度重視與支持。張惇涵指出，這是繼去年4月，拜登專程派遣前聯邦參議員陶德（Christopher Dodd D-CT）率團訪台後，時隔不到一年再次派遣資深訪團訪台，尤其在烏克蘭情勢嚴峻之際，更是彰顯台美關係的「堅若磐石」。此消息引發熱議，網友紛紛湧入《中時新聞網》與臉書相關連結留言：「烏克蘭十萬火急，美國不趕快派兵援烏，反而派人來台，上次萊豬這次換什麼了？」「軍購，萊豬，這次不知是什麼？台灣又要被犧牲。不去協助烏克蘭，跑來台灣，一定有貓膩」、「台灣吃了定心丸之後呢？是不是再加碼買過時的武器呢？」「想藉玩弄台灣棋子向陸再施壓」。
296,https://www.chinatimes.com/newspapers/20220301000279-260208,加碼烏債、俄股？ 法人曝關鍵,投資理財,2022-03-01 04:10,受俄烏開戰影響，近期多數風險性資產波動上升，更緊緊牽動新興市場股債市走勢。在俄烏開戰後，部分法人反而加碼烏債，小幅加碼俄股，法人表示，小幅加碼烏債及俄股主要是因價格已充分反映現實情況。路博邁表示，在強勢貨幣債券看法上，減碼俄羅斯，並加碼烏克蘭，因為目前烏克蘭10年期債券評價已反映政權更換的最壞情境。不過，在本地貨幣方面，則是減碼俄羅斯盧布，並清空烏克蘭部位。至於新興股市方面，路博邁對俄羅斯整體維持小幅加碼的看法。路博邁表示，目前對俄羅斯祭出的制裁主要聚焦於金融產業，因此相關銀行類股表現可能會明顯受挫。雖然在俄烏開戰之日，俄羅斯股市有短暫暫停交易，但隨即恢復正常交易，預期暫停交易不會成短期常態，現階段俄烏局勢仍不穩定，接下來需繼續觀察來自美國、歐盟和英國的進一步潛在制裁、以及俄羅斯的後續行動。
297,https://www.chinatimes.com/realtimenews/20220301004636-260409,中國歷史學者聯合發表公開信譴責侵略 警告戰爭是條不歸路,兩岸,2022-03-01 19:50,俄羅斯入侵烏克蘭後，在全球絕大多數的範圍內遭到反對與唾棄。大陸官方到目前為止，仍拒絕譴責羅斯的侵略行為，甚至要求媒體在論及此事時避免使用侵略、攻擊、戰爭等詞彙，網路上則是一片支援普丁的聲音。但是仍有5名知名的中國歷史學者發表聯署信呼籲反戰，譴責俄羅斯對烏克蘭發動戰爭，並表達對烏克蘭人民的同情。據《英國廣播公司》（BBC）報導，這封5位歷史學者聯署的公開信日前在社交媒體微信上發布，數小時後就被封鎖，只有在外網才看得到。信中寫道：「無論俄羅斯有千種理由，萬般藉口，以武力入侵一個主權國家都是對以聯合國憲章為基礎的國際關係準則的踐踏，是對現有國際安全體系的破壞」，「歷史上的巨大災難往往源於局部衝突」。香港大學歷史學教授徐國琦是其中一位簽署者，他在接受BBC訪問時直接指出：「侵略就是侵略，不能指鹿為馬」。其他簽署公開信的還有南京大學歷史學院教授孫江、北京大學歷史學系教授王立新、清華大學歷史系教授仲偉民和復旦大學歷史系教授陳雁。報導指出，中國與俄羅斯的關係密切，與烏克蘭也有緊密的經濟往來。北京至今沒有公開譴責俄羅斯的侵略行為，甚至避免使用「入侵」一詞，而多用較委婉的辭令督促各方對話。官方媒體在報導中採取了較為親俄的態度，對烏克蘭方面的支持則較為少見。至於在大陸社交媒體上，親俄反美的情緒以及對烏克蘭女性的調侃大量出現。徐教授說，「我們希望呼籲理性、呼籲良知，也呼籲大家走出狹隘的民族主義的陷阱」。公開信中指出：「連日來，網路即時直播戰況：廢墟、炮聲、難民……烏克蘭的傷口深深地刺痛了我們。作為曾經飽受戰爭蹂躪的國家，家破人亡、餓殍千里、割地賠款……，這些苦難和恥辱鑄就了我們的歷史意識，我們對烏克蘭人民的痛苦感同身受。」專門研究第一次世界大戰的徐國琦教授說，一戰是歐洲大國「夢遊般地走進戰爭」，而一旦戰爭打響，就是一條不歸路。戰爭持續了數年，導致包括德意志帝國的4大帝國瓦解，大英帝國和法蘭西共和國2大強國開始走下坡路。二戰時日本向美國不宣而戰，偷襲珍珠港，結果日本成為世界上唯一一個遭受兩顆原子彈襲擊的國家。再比如1979年前蘇聯入侵阿富汗，10年後蘇聯解體。徐國琦說，「如果在21世紀還回到18世紀那種野蠻戰爭，去侵略另一個國家，這對人類文明來說是不可以接受的。作為歷史學者來說，我們認為那一頁已經翻過去了。但是歷史在重演。今天的重演就有可能導致第3次世界大戰，走上不歸路。」他與其他歷史學者在公開信中呼籲，「我們堅決支持烏克蘭人民保家衛國的行動。我們擔憂俄羅斯的武力行為將導致歐洲乃至整個世界局勢的動盪，引發更大範圍的人道主義災難。」在社交媒體微博上，仍可以看到民眾對幾位教授的批評。一些網路公眾號與知名博主指責這幾位教授是選擇性表態，甚至有人留言攻擊他是「奸細、叛徒、顏色革命」，一位網民留言說，「反戰不反美，心裡必有鬼」。對於大陸有些教授因發表言論而受到處罰，徐教授說，「在一片喧囂之中，我們歷史學者應該有一點自己的獨立思考，思考最後的結果對我個人來說不是考量。他們幾位都是德高望重的學者，不管怎麼說，大家心裡都有一個天平，況且我們是反戰、維護和平而已。」
298,https://www.chinatimes.com/newspapers/20220301000304-260119,美促中國表態 這不是旁觀時候,國際大事,2022-03-01 04:10,俄烏戰事讓西方國家一面倒譴責俄羅斯，不過，中國始終未明確反戰。白宮於美東時間2月27日呼籲中國譴責俄羅斯入侵烏克蘭，強調「這不是旁觀的時候」。俄羅斯外交部發言人扎哈羅娃在被媒體問到俄國在世界上是否還有朋友時則表示，「俄羅斯在世界上還有朋友，特別是中國」。不排除未來拜習通話《美國之音》報導，白宮新聞發言人莎琪在接受訪問時表示，北京方面需要採取更多行動，「這不是旁觀的時候。現在是發聲並譴責普丁總統的行為和俄羅斯入侵一個主權國家的時候。」她表示，美國總統拜登最近還未和中國領導人習近平通話，但不排除在未來通話的可能性。「歷史正在被書寫，中國領導層很重要的一步就是要審視他們自己，真正評估他們打算站在哪裡。」回顧近日中國對俄烏情勢的態度，2月21日普丁簽署法令，承認烏克蘭東部頓涅茨克（Donetsk）與盧甘斯克（Lugansk）獨立，22日中國外交部發言人汪文斌在記者會上，接連迴避了14題未正面作答，新華社報導普丁承認烏克蘭東部2個「共和國」時，特別使用引號，顯示中方未承認2「國」地位。在聯合國保持模糊立場戰事爆發後，當西方國家對俄羅斯發動譴責和制裁之際，中國也未明確挺俄，稱烏克蘭問題「有其複雜歷史經緯，局勢演變至今是各種因素共同作用的結果」。隨著俄烏戰事愈演愈烈，中國國家主席習近平25日與普丁通話，表示「支持俄羅斯與烏克蘭通過談判解決問題」，中國依舊保持模糊立場，僅強調「中方根據烏克蘭問題本身的是非曲直決定中方立場，要摒棄冷戰思維，重視和尊重各國合理安全關切，通過談判形成均衡、有效、可持續的歐洲安全機制。」迄今未將莫斯科的行為稱為「入侵」。甚至在2月25、27日的兩場聯合國的會議上，分別要求俄羅斯撤軍、就俄烏局勢舉行緊急決議，中國都投下棄權票，中國常駐聯合國代表張軍還強調，「當務之急是各方保持必要克制」。未刪除陸媒批俄言論不過，觀察大陸媒體近2天的報導，立場似乎有些「鬆動」，有陸媒以「俄國內反戰情緒湧動，俄氣候代表為烏克蘭遭進攻道歉」為題報導；大陸時政新媒體「牛彈琴」點出，國際輿論至少在英、法、西班牙語等體系，「毫無疑問都呈現罵俄羅斯的一邊倒狀況」。這些報導都沒有被官方刪除。
299,https://www.chinatimes.com/newspapers/20220301000076-260202,俄烏談判難解歐美股重挫,財經要聞,2022-03-01 04:10,經歷連日戰事後，俄羅斯與烏克蘭28日展開首次會談。烏克蘭表示，此次談判目標是要求俄羅斯軍隊立即停火並撤出該國。但是總統澤倫斯基（Volodymyr Zelensky）坦言，儘管此次會談難以尋求突破，但總得努力一試。俄烏會談難見和平曙光，導致歐美股市大跌。美股道瓊工業指數28日早盤下跌400多點或1.2％，標普5百指數與那斯達克指數分別下挫0.9％與0.6％。德國與英國大盤28日分別下挫2.3％與1.52％，法國大盤下跌逾3％，Stoxx 600泛歐股市指數也下挫1.4％。俄烏周一於烏克蘭與白俄羅斯邊境的戈麥市（Gomel）展開談判。烏克蘭派出國防部長與高層官員參與會談，但俄國代表團卻由前文化部長梅金斯基（Vladimir Medinsky）領軍、位階不高，令外界對於俄國是否有意停戰與總統普丁意圖打上問號。西方官員認為，普丁計畫推翻烏克蘭政府並建立聽命他指揮的魁儡政權。而這意味著：澤倫斯基的和平盼望恐將落空。烏克蘭總統澤倫斯基27日指出，他對於此次會談並未抱持太大期望，雙方不太可能達成共識，但總得「姑且一試」。澤倫斯基周日與英國首相強生（Boris Johnson）通話時表示，俄羅斯軍隊持續進逼烏克蘭首都基輔，接下來24個小時對於烏克蘭「至關重要」，顯示該國情勢險峻。強生則讚許澤倫斯基自俄國入侵以來領導表現，帶領烏克蘭軍隊與百姓抵抗外敵。烏克蘭各大城市持續承受俄國軍隊從北東南三方攻擊。俄羅斯派出戰機轟炸烏克蘭基礎建設並造成傷亡，地面則派出部隊持續推進，幸好烏克蘭軍隊與志願軍強力回擊，令俄國進犯速度不如他們預期。烏克蘭方面表示，這次戰事迄今已造成352人死亡，其中包括14名孩童。俄羅斯軍隊死亡人數則達到數千人，但此估計遭俄國否認。烏克蘭局勢未來幾天恐怕會變得更加危急，原因在於白俄羅斯可能派軍支援俄國。此外，白俄羅斯近日通過修憲公投放棄非核地位，令外界擔憂此舉恐導致俄國於白俄部署核武，進而引發更大衝突。
300,https://www.chinatimes.com/newspapers/20220301000069-260309,烏國台灣留學生 撤退波蘭華沙,話題觀察,2022-03-01 04:10,俄國入侵烏克蘭，我在烏克蘭的留學生中，有6人在我駐波蘭代表處協助下，經過4、50小時的車程，均已安全撤退到波蘭華沙。教育部昨表示，其中4名學生將於近日返台，另2人則決定暫時留在波蘭。對於返台的學生，教育部將協助他們就學銜接。教育部表示，我在烏克蘭就學的12名留學生中，其中3名已於2月24日返台；另9名學生，6名已搭乘撤僑巴士於2月26日平安抵達波蘭，未搭乘撤僑巴士的3名學生，原在基輔1名留學生已撤往斯洛伐克、原烏東及烏南各1名留學生仍留原地，將續由駐處協處。教育部進一步指出，6名抵達波蘭華沙的留學生中，其中4名近日將搭機返台，2名暫留波蘭。對於這4名要返台的學生，教育部會派員到機場接機，協助他們進行檢疫及通關作業，並依其需求協請衛福部安排入住集中檢疫所，或依個人需要自行訂防疫旅館。留學生Simon在與台灣媒體建立的聯絡群組中表示，他們從烏克蘭搭乘撤僑專車前往波蘭，前後歷經4、50個小時，過程中無法好好洗澡、睡覺及吃飯，實在很累。途中，其中1名駕駛沿路告訴軍方「我們是台灣駐波瀾代表處的車」，所以一路通關。不過Simon提到，從烏克蘭進入波蘭的邊境，1公里路他們排隊等了快10小時，軍人上車來檢查文件，過程又累、又睏、又餓，幾乎說不上話。進入波蘭後，在我國駐波蘭代表處的協助下，他們才得以稍微休息、吃飯及洗澡。他現在人在華沙，未來有可能走、也有可能留，要看情勢變化再做決定。
301,https://www.chinatimes.com/realtimenews/20220301000936-260408,控從事間諜活動 美驅逐12俄駐聯外交官,國際,2022-03-01 08:22,俄羅斯持續進攻烏克蘭，美國有線電視新聞網（CNN）報導，美國已經要求12名俄羅斯駐聯合國外交官離開美國，指控他們從事間諜活動。美國駐聯合國副代表米爾斯（Richard Mills）在昨（28）日的一場安理會會議上表示，俄羅斯外交官被要求離開是因為他們被控從事「不符合外交官責任及義務的活動」。美國駐聯合國代表團在聲明中表示，這12名俄羅斯外交官是「情報人員」，「濫用在美國的居留權，從事不利於我們國家的間諜活動。」目前尚不清楚哪12名俄羅斯外交官被驅逐出境，俄羅斯駐聯合國大使涅班濟亞（Vassily Nebenzia）表示美國官員來函，限期俄外交官於3月7日前離境。他痛批美方驅逐出境的理由「令人不滿意」。
302,https://www.chinatimes.com/realtimenews/20220301005162-260408,俄羅斯遭西方孤立 外媒曝：北京也悄悄離開,國際,2022-03-01 23:06,「半島電視台」（Al Jazeera）2月28日報導，在俄羅斯因入侵烏克蘭而日漸遭國際孤立、部分銀行已被踢出環球銀行金融電信協會（SWIFT）之下，該國最關鍵的經濟生命線中國大陸，也傳出正悄悄劃清界線，部分官方銀行已開始限制或停止對俄羅斯的融資交易。「半島電視台」整理「路透社」（Reuters）等外媒的消息，稱雖然北京政府拒絕將俄羅斯出兵烏克蘭一事定義為「入侵」，反而譴責西方國家的制裁決定，但大陸官方銀行傳出「悄悄地與陷入困境的俄羅斯經濟保持距離」，包括中國銀行和中國工商銀行已限制對購買俄羅斯商品的融資、中國銀行新加坡分行已停止涉及俄羅斯石油和企業的融資交易等。香港的法國外貿銀行（Natixis SA）亞太區首席經濟學家艾西亞（Alicia Garcia Herrero）認為，北京政府將遵守西方的制裁規定，但繼續通過自身金融體系對俄羅斯進行支援，雖然會受到限制，但仍大有可為。她說：「就連歐洲銀行都還可以為相關能源進口提供融資，那中國大陸銀行有什麼理由不這麼做呢？」艾西亞指出，前述中國大陸銀行的舉動，應該只是為了因應現有西方制裁，不代表北京政府即將拋棄俄羅斯。不過「半島電視台」指出，若美國及其盟友推動更嚴厲的制裁，中國大陸將更難在兩者之間維持平衡；法國外貿銀行經濟學者吳卓殷（Gary Ng）便表示，即使在現有制裁之下，中國大陸仍能在很大程度上維持與俄羅斯的合法貿易，但若美國擴大制裁範圍並實施次級制裁（secondary sanction），即同時限制第三國的公司或個人與俄羅斯進行金融和貿易，才是「真正棘手的時候」。
303,https://www.chinatimes.com/realtimenews/20220301004255-260408,影》俄狂炸住宅區 烏第2大城彈如雨下屍遍地 衝擊畫面曝光,國際,2022-03-01 18:20,俄羅斯軍隊昨（28）日轟炸烏克蘭第2大城哈爾科夫（Kharkiv）的住宅區，造成至少11人喪命，外媒形容彈砲如雨般不斷從天而降，直接落向民宅，網路上出現許多住宅區街道上躺著遺體的畫面，還有一名婦女的雙腿在轟炸中受傷，眼前就矗立一枚火箭彈。綜合英國《鏡報》（Mirror）、《衛報》（The Guardian）、美國國家廣播公司新聞網（NBC News）報導，俄羅斯軍隊昨日猛轟位在烏克蘭東部的第2大城哈爾科夫市，影片顯示數十枚火箭彈「如雨般」落在市中心住宅區，烏克蘭內政部顧問吉拉成柯（Anton Gerashchenko）在臉書表示，俄軍猛轟造成哈爾科夫市數十人喪命，不過後續當地首長西涅古波夫（Oleg Synegubov）表示，這起轟炸造成11人喪命。社群媒體上也陸續出現哈爾科夫市「彈如雨下」的畫面，影片中的街區出現一束束彈砲落地引發的火光，接著揚起陣陣塵土。另外有畫面顯示街頭躺了一具又一具遺體，還有記者描述街道上散落屍塊。網路上也出現一名婦女跌坐在公寓1樓大廳的畫面，她的一條腿被炸斷、仍在流血，公寓大門前就插著一枚火箭彈。哈爾科夫市長泰芮可夫（Igor Terekhov）表示，死者包含3名孩童，另外有4名死者是在從避難所外出取水時不幸被炸死，另外一家五口則是在車內被活活燒死。他痛批這不只是一場戰爭，而是對烏克蘭人的「大屠殺」。
304,https://www.chinatimes.com/newspapers/20220301000121-260203,穆斯克神救援 在烏啟用星鏈上網,全球財經,2022-03-01 04:10,SpaceX創辦人兼執行長穆斯克（Elon Musk）在收到烏克蘭副總理費多羅夫（Mykhailo Fedorov）求救後，十小時內完成人造衛星與終端機部署，在烏克蘭境內提供星鏈（Starlink）衛星網路服務。自從24日俄羅斯總統普丁宣布對烏克蘭執行特殊軍事行動以來，數日的戰爭已造成烏克蘭各地基礎建設嚴重損壞，許多地區斷電、網路斷線，迫使烏克蘭需向西方尋求協助。身兼副總理及數位轉型部長的費多羅夫26日在推特向穆斯克發文表示：「在你嘗試殖民火星之際，俄羅斯正嘗試占領烏克蘭！當你的火箭成功從太空返回降落地球時，俄羅斯的火箭正在攻擊烏克蘭人民！我們請求你在烏克蘭提供星鏈終端機，用來呼籲理智的俄羅斯人站出來。」穆斯克在十小時後發布推文回應：「星鏈已在烏克蘭啟用服務，未來將有更多終端機上線。」穆斯克透過SpaceX推出的星鏈計畫是利用SpaceX火箭將成千上萬顆人造衛星發射到距離地表340英里的低軌道，再由這些人造衛星發射網路訊號到缺乏網路基礎建設的偏遠地區，終極目標是讓全球人口都有寬頻網路可用。穆斯克在去年中曾宣稱星鏈已出貨10萬組接收衛星網路訊號的終端機，並在全球14個國家取得營運執照。今年2月南太平洋島國東加海底火山爆發後，穆斯克在第一時間提供星鏈衛星網路服務到東加偏遠地區，如今烏俄戰爭爆發星鏈再度派上用場。美國國防部官員在26日表示，烏克蘭自戰爭爆發後斷斷續續出現斷電情形，但是多數地區仍有網路服務。
305,https://www.chinatimes.com/realtimenews/20220301004007-260408,不斷更新》俄羅斯以飛彈連續攻擊 基輔電視塔爆炸 5平民喪生,國際,2022-03-01 17:45,（2日 05：07更新）據外媒報導，烏克蘭首都基輔電視台遭到俄羅斯以飛彈攻擊，發生爆炸。目擊者拍攝的影片顯示，電視塔旁先是冒出陣陣濃煙，拍攝期間又發生第二次大爆炸，電視台發射塔旁爆出巨大火球，造成5名平民喪生。內政部表示，有些設備受損，一些電視頻道無法運作，不過電視塔結構安然無恙。（21：47更新）俄羅斯國防部1日警告，即將對基輔發動打擊，聲稱目標為位於當地的烏克蘭國家安全局技術中心和第72心戰中心，以防止針對俄羅斯的資訊戰，並要求居住在附近的居民離開。（20：52更新）「英國廣播公司」報導，烏克蘭國家緊急服務處告訴當地媒體，俄軍1日上午對烏克蘭第2大城哈爾科夫發動的重火力攻擊，擊中該城自由廣場的政府行政大樓、歌劇院和音樂廳，至少造成10人死亡、20人受傷。（19：42更新）據法媒報導，烏克蘭總統澤倫斯基強調，保衛首都基輔免受俄軍攻擊是「當務之急」。澤倫斯基透過影片發布聲明稱：「今天保衛首都是國家的當務之急」。澤倫斯基痛批，俄羅斯對烏克蘭第二大城市哈爾科夫的襲擊故意瞄準平民，是「國家恐怖主義」。「英國廣播公司」（BBC）報導，印度官方證實一名印度學生於俄軍對哈爾科夫的攻擊中喪生；聯合國2月28日則表示，俄烏戰爭期間已有超過400名平民傷亡，其中至少102人不幸死亡。（18：30更新）俄羅斯國防部長紹伊古表示，俄軍將繼續在烏克蘭展開特別軍事行動，直到達成既定目標。紹伊古還指控，烏克蘭使用平民作為人肉盾牌，在居民區、學校和幼稚園附近部署多處火炮發射系統和大口徑迫擊炮等武器。他表示，對俄方來說最重要的是保護俄羅斯聯邦免受西方國家的軍事威脅。西方國家試圖利用烏克蘭人民與俄羅斯對抗。對於這些指控，烏克蘭方面尚無回應。「英國廣播公司」（BBC）1日報導，在稍早傳出白俄羅斯有意出兵支援俄羅斯、甚至派出精銳傘兵空降烏克蘭首都基輔後，總統魯卡申柯（Alexander Lukashenko）出面表示，該國部隊將不會參與俄羅斯的軍事行動。魯卡申柯指出，白俄羅斯「並不打算參與俄羅斯的特種軍事作戰」，不僅因為俄羅斯總統普丁（Vladimir Putin）未提出相關要求，更因為「沒有必要」。美國國務院發言人普萊斯（Ned Price）2月28日才表示，白俄羅斯任由俄軍自其領土對烏克蘭發動攻勢，根本是對「愚弄自家主權」。
